{
  "formatVersion": 1,
  "source": "lol-desktop-assistant-sample",
  "patch": "26.08",
  "region": "KR",
  "queue": "RANKED_SOLO_5X5",
  "tier": "EMERALD_PLUS",
  "generatedAt": "2026-04-25T00:00:00Z",
  "champions": [
    {
      "championId": 266,
      "championName": "Aatrox",
      "championAlias": "Aatrox",
      "lane": "top",
      "games": 184000,
      "wins": 93472,
      "picks": 184000,
      "bans": 22816,
      "winRate": 50.8,
      "pickRate": 8.9,
      "banRate": 12.4,
      "overallScore": 32.6
    },
    {
      "championId": 86,
      "championName": "Garen",
      "championAlias": "Garen",
      "lane": "top",
      "games": 139000,
      "wins": 72419,
      "picks": 139000,
      "bans": 10425,
      "winRate": 52.1,
      "pickRate": 6.8,
      "banRate": 7.5,
      "overallScore": 31.9
    },
    {
      "championId": 64,
      "championName": "Lee Sin",
      "championAlias": "LeeSin",
      "lane": "jungle",
      "games": 276000,
      "wins": 136620,
      "picks": 276000,
      "bans": 47472,
      "winRate": 49.5,
      "pickRate": 14.9,
      "banRate": 17.2,
      "overallScore": 34.4
    },
    {
      "championId": 5,
      "championName": "Xin Zhao",
      "championAlias": "XinZhao",
      "lane": "jungle",
      "games": 132000,
      "wins": 69036,
      "picks": 132000,
      "bans": 7656,
      "winRate": 52.3,
      "pickRate": 6.4,
      "banRate": 5.8,
      "overallScore": 31.5
    },
    {
      "championId": 103,
      "championName": "Ahri",
      "championAlias": "Ahri",
      "lane": "middle",
      "games": 197000,
      "wins": 100667,
      "picks": 197000,
      "bans": 16351,
      "winRate": 51.1,
      "pickRate": 9.6,
      "banRate": 8.3,
      "overallScore": 32.2
    },
    {
      "championId": 777,
      "championName": "Yone",
      "championAlias": "Yone",
      "lane": "middle",
      "games": 231000,
      "wins": 114114,
      "picks": 231000,
      "bans": 56595,
      "winRate": 49.4,
      "pickRate": 11.2,
      "banRate": 24.5,
      "overallScore": 34.9
    },
    {
      "championId": 222,
      "championName": "Jinx",
      "championAlias": "Jinx",
      "lane": "bottom",
      "games": 248000,
      "wins": 128712,
      "picks": 248000,
      "bans": 25792,
      "winRate": 51.9,
      "pickRate": 12.6,
      "banRate": 10.4,
      "overallScore": 33.8
    },
    {
      "championId": 145,
      "championName": "Kai'Sa",
      "championAlias": "Kaisa",
      "lane": "bottom",
      "games": 289000,
      "wins": 145656,
      "picks": 289000,
      "bans": 34102,
      "winRate": 50.4,
      "pickRate": 15.3,
      "banRate": 11.8,
      "overallScore": 34.5
    },
    {
      "championId": 412,
      "championName": "Thresh",
      "championAlias": "Thresh",
      "lane": "support",
      "games": 244000,
      "wins": 123220,
      "picks": 244000,
      "bans": 23424,
      "winRate": 50.5,
      "pickRate": 12.8,
      "banRate": 9.6,
      "overallScore": 33.4
    },
    {
      "championId": 497,
      "championName": "Rakan",
      "championAlias": "Rakan",
      "lane": "support",
      "games": 151000,
      "wins": 78520,
      "picks": 151000,
      "bans": 8909,
      "winRate": 52.0,
      "pickRate": 7.9,
      "banRate": 5.9,
      "overallScore": 31.9
    }
  ]
}
